{
  "schema": "drillbalancer.events/1",
  "taxonomy_version": 1,
  "recording_id": "20261026T144505Z_synt_0905",
  "revision": 1,
  "coverage_us": [
    3242633,
    8079932
  ],
  "events": [
    {
      "id": "e1",
      "type": "motor_on",
      "t_us": 4138537,
      "source": "user",
      "confidence": 1.0
    },
    {
      "id": "e2",
      "type": "contact",
      "t_us": 5443223,
      "source": "user",
      "confidence": 1.0,
      "hole": 1
    },
    {
      "id": "e3",
      "type": "motor_off",
      "t_us": 6982470,
      "source": "user",
      "confidence": 1.0
    },
    {
      "id": "e4",
      "type": "retract",
      "t_us": 7803833,
      "source": "user",
      "confidence": 1.0,
      "hole": 1
    },
    {
      "id": "e5",
      "type": "motor_on",
      "t_us": 7853833,
      "source": "user",
      "confidence": 1.0
    }
  ],
  "spans": [
    {
      "id": "s1",
      "type": "stuck",
      "t0_us": 6431968,
      "t1_us": 6982470,
      "hole": 1,
      "source": "user",
      "confidence": 1.0
    }
  ],
  "holes": [
    {
      "hole": 1,
      "through": false,
      "material": null,
      "outcome_tags": [
        "bit_stuck"
      ],
      "off_angle_deg": 0.08,
      "off_angle_source": "computed"
    }
  ]
}
